,0
612_939_DF_DCCV_LAU_OCCUP_RED_2,Degree and profession group
612_939_DF_DCCV_LAU_OCCUP_RED_3,Degree group and monthly income
612_939_DF_DCCV_LAU_OCCUP_RED_4,Professional status
612_939_DF_DCCV_LAU_OCCUP_RED_5,Economic activity and sector of employement
612_939_DF_DCCV_LAU_OCCUP_RED_6,Job satisfaction
612_939_DF_DCCV_LAU_OCCUP_RED_7,Region of residence and occupational status
612_939_DF_DCCV_LAU_OCCUP_RED_8,Region of residence and monthly income
613_934,High school graduates - socio-demographic characteristics and curriculum
613_934_DF_DCCV_DIPL_DEM_FORM_1,Type of diploma
613_934_DF_DCCV_DIPL_DEM_FORM_10,University enrollment - gender and type of diploma
613_934_DF_DCCV_DIPL_DEM_FORM_11,Registration to university - region of habitual residence
613_934_DF_DCCV_DIPL_DEM_FORM_12,Enrollment in non-university tertiary studies - gender and type of diploma
613_934_DF_DCCV_DIPL_DEM_FORM_13,Enrollment in non-university tertiary studies - region of habitual residence
613_934_DF_DCCV_DIPL_DEM_FORM_2,Legal nature of the school and satisfaction
613_934_DF_DCCV_DIPL_DEM_FORM_3,Age
613_934_DF_DCCV_DIPL_DEM_FORM_4,Citizenship and cohabiting family members
613_934_DF_DCCV_DIPL_DEM_FORM_5,Place of living region
613_934_DF_DCCV_DIPL_DEM_FORM_6,Parents' highest level of education attained
613_934_DF_DCCV_DIPL_DEM_FORM_7,Registration for any type of post-diploma course
613_934_DF_DCCV_DIPL_DEM_FORM_8,Registration for professional training courses - gender and type of diploma
613_934_DF_DCCV_DIPL_DEM_FORM_9,Registration for professional training courses - region of habitual residence
613_935,High school graduates - employment conditions and remuneration
613_935_DF_DCCV_DIPL_OCCUP_REDD_1,Sex and type of diploma
613_935_DF_DCCV_DIPL_OCCUP_REDD_10,Region and wage
613_935_DF_DCCV_DIPL_OCCUP_REDD_2,Occupation CP2011
613_935_DF_DCCV_DIPL_OCCUP_REDD_3,Professional status and hours worked
613_935_DF_DCCV_DIPL_OCCUP_REDD_4,Sector of employement and economic activity
613_935_DF_DCCV_DIPL_OCCUP_REDD_5,Wage by diploma
613_935_DF_DCCV_DIPL_OCCUP_REDD_6,Wage and type of employment
613_935_DF_DCCV_DIPL_OCCUP_REDD_7,High school degree usefulness
613_935_DF_DCCV_DIPL_OCCUP_REDD_8,Job satisfaction (average values)
613_935_DF_DCCV_DIPL_OCCUP_REDD_9,Region and occupational status
613_936,High school graduates - seeking a job
613_936_DF_DCCV_DIPL_RIC_1,Seeking a job and professional status
613_936_DF_DCCV_DIPL_RIC_2,Seeking a job and place of residence
613_936_DF_DCCV_DIPL_RIC_3,"Professional status, time and place of work desired"
61_69,Published books
61_69_DF_DCIS_PUBBLICATE3_1,Published books - Key data
61_69_DF_DCIS_PUBBLICATE3_2,Price and printed copies
669_1073,Environmental tax revenue 2014 version
669_1073_DF_DCCN_IMPAMB1_B14_1,Tax category - editions from December 2014 to October 2018
669_1073_DF_DCCN_IMPAMB1_B14_2,Paying unit - editions from December 2014 to October 2018
669_1073_DF_DCCN_IMPAMB1_B14_3,Taxes paid by economic activity - editions from December 2014 to October 2018
669_1073_DF_DCCN_IMPAMB1_B14_4,CEPA class - editions from December 2014 to October 2018
669_1073_DF_DCCN_IMPAMB1_B14_5,Use of the tax revenue - editions from December 2014 to October 2018
669_1080,NAMEA air emissions (NACE Rev. 2) 2014 version
669_1080_DF_DCCN_CONTIEMATMREV2_B14_1,Production activities - editions from November 2014 to November 2018
669_1080_DF_DCCN_CONTIEMATMREV2_B14_2,Households - editions from November 2014 to November 2018
669_1080_DF_DCCN_CONTIEMATMREV2_B14_3,Bridging items between NAMEA total and UNFCCC/CLRTAP total - editions from November 2014 to November 2018
669_1080_DF_DCCN_CONTIEMATMREV2_B14_4,Intensity of output and value added - editions from November 2014 to November 2018
669_1080_DF_DCCN_CONTIEMATMREV2_B14_5,Intensity of employment - editions from November 2014 to November 2018
669_1081,Physical energy flow accounts (PEFA) 2014 version
669_1081_DF_DCCN_PEFA_B14_1,Supply and use: scheme - December 2018 edition
669_1081_DF_DCCN_PEFA_B14_2,Supply by activity and energy flow - December 2018 edition
669_1081_DF_DCCN_PEFA_B14_3,Use by activity and energy flow - December 2018 edition
669_1081_DF_DCCN_PEFA_B14_4,Emission-relevant use by activity and energy flow (related to fuel combustion) - December 2018 edition
669_1081_DF_DCCN_PEFA_B14_5,Vectors of key energy indicators - December 2018 edition
669_1081_DF_DCCN_PEFA_B14_6,Bridge table: energy consumption - December 2018 edition
669_1113,Environmental protection expenditure 2014 version
669_1113_DF_DCCN_SPESAPROTAMB_B14_1,National expenditure - April 2018 and January 2019 editions
669_1113_DF_DCCN_SPESAPROTAMB_B14_2,Economic aggregates by institutional sector - April 2018 and January 2019 editions
669_1113_DF_DCCN_SPESAPROTAMB_B14_3,Gross fixed capital formation and ancillary output of corporations as ancillary - April 2018 and January 2019 editions
669_1116,National materials' use accounts 2014 version
669_1116_DF_DCCN_FLUMAT_B14_1,Economy-wide material flow indicators - editions from January 2016 to February 2019
669_1116_DF_DCCN_FLUMAT_B14_2,Domestic extraction of used materials (editions from January 2016 to February 2019)
669_1116_DF_DCCN_FLUMAT_B14_3,Exchanges with the rest of the world - editions from January 2016 to February 2019
669_1119,Environmental goods and services accounts 2014 version
669_1119_DF_DCCN_EGSS_B14_1,"Output, value added, exports - Februay 2019 edition"
669_1119_DF_DCCN_EGSS_B14_2,"Employmenti, full time equivalent - Februay 2019 edition"
669_964,Environmental tax revenue
669_967,NAMEA air emissions (NACE Rev. 2) 2011 version
68_1220,Trips by arrangement
68_1220_DF_DCCV_VIAGGI_ORG_1,Accomodation booking
68_1220_DF_DCCV_VIAGGI_ORG_2,Accomodation booking
68_1220_DF_DCCV_VIAGGI_ORG_3,Internet booking
68_1220_DF_DCCV_VIAGGI_ORG_4,Accommodation booking via internet
68_1220_DF_DCCV_VIAGGI_ORG_5,Transport booking via internet
68_1221,Trips by purpose
68_1221_DF_DCCV_VIAGGI_CAPI_2_1,Holidays
68_1221_DF_DCCV_VIAGGI_CAPI_2_2,Holiday trips of 4 or more overnight stays
68_1221_DF_DCCV_VIAGGI_CAPI_2_3,Holiday trips for pleasure/leisure - annual data
68_1221_DF_DCCV_VIAGGI_CAPI_2_4,Holiday trips for pleasure/leisure - quarterly data
68_1221_DF_DCCV_VIAGGI_CAPI_2_5,Holiday trips for pleasure/leisure by main destination
68_1221_DF_DCCV_VIAGGI_CAPI_2_6,Holiday trips for pleasure/leisure by lenght
68_1221_DF_DCCV_VIAGGI_CAPI_2_7,Business trips
68_1221_DF_DCCV_VIAGGI_CAPI_2_8,Cultural trips - quarterly data
68_1221_DF_DCCV_VIAGGI_CAPI_2_9,Cultural trips by type of activity
68_161,Persons who went and didn't go on holiday
68_161_DF_DCCV_TURANN_NO_TURAN_CAPI_1,Persons aged 15 and over who didn't go on holiday
68_161_DF_DCCV_TURANN_NO_TURAN_CAPI_2,Persons who went on holiday
68_265,Expenditure on tourism trips in rented accomodations
68_265_DF_DCCV_VIAGGI_SPESE_CAPI_1,Trips
68_265_DF_DCCV_VIAGGI_SPESE_CAPI_2,Holidays
68_265_DF_DCCV_VIAGGI_SPESE_CAPI_3,Type of accomodation
68_338,Same-day visits
68_338_DF_DCCV_ESC_CAPI_1,Quarterly data
68_338_DF_DCCV_ESC_CAPI_2,Main purpose
68_338_DF_DCCV_ESC_CAPI_3,Main means of transport
68_338_DF_DCCV_ESC_CAPI_4,Region of destination
68_356,Persons who made trips
68_356_DF_DCCV_TURISTI_CAPI_1,Travelers for 100 residents
68_356_DF_DCCV_TURISTI_CAPI_2,Gender
68_356_DF_DCCV_TURISTI_CAPI_3,Gender and age class
68_356_DF_DCCV_TURISTI_CAPI_4,Professional status
68_356_DF_DCCV_TURISTI_CAPI_5,Destination
68_356_DF_DCCV_TURISTI_CAPI_6,Residence
68_356_DF_DCCV_TURISTI_CAPI_7,For business travelers
68_357,Overnight stays for trips
68_357_DF_DCCV_TURNOT_CAPI_1,Overnight stays in Italy and region of destination
68_357_DF_DCCV_TURNOT_CAPI_2,Overnight stays abroad and country of destination
68_357_DF_DCCV_TURNOT_CAPI_3,Type of trip
68_357_DF_DCCV_TURNOT_CAPI_4,Gender and age class
68_357_DF_DCCV_TURNOT_CAPI_5,Professional status
68_357_DF_DCCV_TURNOT_CAPI_6,Destination and residence
68_357_DF_DCCV_TURNOT_CAPI_7,Destination and type of accommodation
68_357_DF_DCCV_TURNOT_CAPI_8,Average number of overnight stays for trips
68_357_DF_DCCV_TURNOT_CAPI_9,"Vacation nights for 1,000 residents (daily averages)"
68_359,Trips by characteristics of the tourist
68_359_DF_DCCV_VIAGGI_RES_1,"Trips by gender, age group and type of trip. Absolute values (in thousands) - National Data"
68_359_DF_DCCV_VIAGGI_RES_10,Trips by gender and type of trip. Percentage values on trips of the same type - National Data
68_359_DF_DCCV_VIAGGI_RES_11,Trips by age group and type of trip. Percentage values on trips of the same type - National Data
68_359_DF_DCCV_VIAGGI_RES_12,Trips by type of trip and origin. Percentage values on trips of the same type - Sub National Data
68_359_DF_DCCV_VIAGGI_RES_13,"Trips by type of trip, origin e destination. Percentage values on trips of the same type and with the same destination - Sub National Data"
68_359_DF_DCCV_VIAGGI_RES_14,"Trips by gender, age group and type of trip. Percentage values on trips of the same type made by people with same characteristics - National Data"
68_359_DF_DCCV_VIAGGI_RES_15,Trips by destination and type of trip. Percentage values on trips of the same type made by people with the same origin - Sub National Data
68_359_DF_DCCV_VIAGGI_RES_16,Trips made by residend aged 15 and over by employment status and type of trip. Percentage values on trips of the same type - National Data
68_359_DF_DCCV_VIAGGI_RES_17,"Holidays by duration, main means of transport and origin. Percentage values on holiday trips of the same duration and with the same origin of person who made holiday - Sub National Data"
68_359_DF_DCCV_VIAGGI_RES_18,"Holidays by duration, main accomodation and origin. Percentage values on holiday trips of the same duration and with the same origin of person who made holiday - Sub National Data"
68_359_DF_DCCV_VIAGGI_RES_2,Trips by origin and type of trip. Absolute values (in thousands) - Sub National Data
68_359_DF_DCCV_VIAGGI_RES_3,"Trips by type of trip, origin e destination. Absolute values (in thousands) - Sub National Data"
68_359_DF_DCCV_VIAGGI_RES_4,Trips by origin and type of trip. Absolute values (in thousands) - Type of municipality
68_359_DF_DCCV_VIAGGI_RES_5,Trips made by residend aged 15 and over by employment status and type of trip. Absolute values (in thousands) - National Data
68_359_DF_DCCV_VIAGGI_RES_6,"Holidays by duration, main means of transport and origin. Absolute values (in thousands) - Sub National Data"
68_359_DF_DCCV_VIAGGI_RES_7,"Holidays by duration, main accomodation and origin. Absolute values (in thousands) - Sub National Data"
68_359_DF_DCCV_VIAGGI_RES_8,Trips by origin and type of trip. Percentage values on trips with the same origin of person who made trip - Sub National Data
68_359_DF_DCCV_VIAGGI_RES_9,Trips by origin and type of trip. Percentage values on trips with the same origin of person who made trip- Type of municipality
68_365,Trips by purpose
68_365_DF_DCCV_VIAGGI_1,Holiday trips by main purpose and duration. Absolute values (in thousands) - National Data
68_365_DF_DCCV_VIAGGI_10,Holidays trips for main purpose
68_365_DF_DCCV_VIAGGI_11,Holiday trips of 4 or more overnight stays
68_365_DF_DCCV_VIAGGI_12,Holiday trips for pleasure (until 2012)
68_365_DF_DCCV_VIAGGI_13,Holiday trips for pleasure and destination (v.p. from 2013)
68_365_DF_DCCV_VIAGGI_14,Business trips by main purpose
68_365_DF_DCCV_VIAGGI_2,Holiday trips by main purpose and duration. Percentage values on holiday trips with the same duration- National Data
68_365_DF_DCCV_VIAGGI_3,Holiday trips of 4 or more overnight stays by quarter and duration. Absolute values (in thousands) - National Data
68_365_DF_DCCV_VIAGGI_4,Holiday trips of 4 or more overnight stays by quarter and duration. Percentage values on holiday trips of 4 or more overnight stays made during the reporting
68_365_DF_DCCV_VIAGGI_5,Holiday trips for pleasure/leisure by type of holiday and duration - Absolute values (in thousands) - National Data
68_365_DF_DCCV_VIAGGI_6,Holiday trips for pleasure/leisure by type of holiday and duration - Percentage values on holiday trips with the same duration - National Data
68_365_DF_DCCV_VIAGGI_7,Holiday trips for pleasure/leisure by type of destination-share per 100 trips with the same destination - National Data
68_365_DF_DCCV_VIAGGI_8,Business trips by main purpose. Absolute values (in thousands) - National Data
68_365_DF_DCCV_VIAGGI_9,Business trips by main purpose. Percentage values on business trips - National Data
68_370,Persons not participating in holidays (quarterly data)
68_370_DF_DCCV_NON_TURISTI_1,Persons not participating in holidays by main reason and quarter. Absolute values (in thousands) - National Data
68_370_DF_DCCV_NON_TURISTI_2,Persons not participating in holidays by main reason and quarter.-Percentage compositions - National Data
68_370_DF_DCCV_NON_TURISTI_3,Main reasons
68_371,Persons who made trips (quarterly data)
68_371_DF_DCCV_TURISTI_1,"Persons who made trips by type of trip, destination and quarter. Absolute values (in thousands) - National Data"
68_371_DF_DCCV_TURISTI_10,Employed aged 15 and over who made business trips by quarter. Absolute values (in thousands) - Sub National Data
68_371_DF_DCCV_TURISTI_11,Employed aged 15 and over who made business trips by gender and quarter. Share per 100 inhabitans with the same characteristics - National Data
68_371_DF_DCCV_TURISTI_12,Employed aged 15 and over who made business trips by quarter. Share per 100 inhabitans with the same characteristics- Sub National Data
68_371_DF_DCCV_TURISTI_13,"Persons aged 15 and over who made trips by type of trip, employment situation and quarter. Absolute values (in thousands) - National Data"
68_371_DF_DCCV_TURISTI_14,"Persons aged 15 and over who made trips by type of trip, employment situation and quarter. Share per 100 inhabitants with the same characteristics - National Data"
68_371_DF_DCCV_TURISTI_15,Persons who made trips. Average value of the 4 quarters. Share per 100 inhabitants - Sub National Data
68_371_DF_DCCV_TURISTI_16,Employed aged 15 and over who made business trips. Average value of the 4 quarters. Absolute values (in thousands) - Sub National Data
68_371_DF_DCCV_TURISTI_17,Employed aged 15 and over who made business trips. Average value of the 4 quarters. Share per 100 inhabitans with the same characteristics - Sub National Data
68_371_DF_DCCV_TURISTI_18,Type of trip and destination
68_371_DF_DCCV_TURISTI_19,Type of trip and gender
68_371_DF_DCCV_TURISTI_2,"Persons who made trips by type of trip, gender and quarter. Absolute values (in thousands) - National Data"
68_371_DF_DCCV_TURISTI_20,Type of trip and age group
68_371_DF_DCCV_TURISTI_21,Type of trip and employment situation
68_371_DF_DCCV_TURISTI_22,Sub National Data
68_371_DF_DCCV_TURISTI_23,Average value
68_371_DF_DCCV_TURISTI_24,Gender
68_371_DF_DCCV_TURISTI_25,Sub National Data
68_371_DF_DCCV_TURISTI_26,Average values
68_371_DF_DCCV_TURISTI_3,"Persons who made trips by type of trip, age group and quarter. Absolute values (in thousands) - National Data"
68_371_DF_DCCV_TURISTI_4,Persons who made trips by type of trip and quarter. Absolute values (in thousands) - Sub National Data
68_371_DF_DCCV_TURISTI_5,"Persons who made trips by type of trip, destination and quarter. Share per 100 inhabitants - National Data"
68_371_DF_DCCV_TURISTI_6,Persons who made trips by type of trip and quarter. Share per 100 inhabitants - Sub National Data
68_371_DF_DCCV_TURISTI_7,"Persons who made trips by type of trip, gender and quarter. Share per 100 inhabitants with the same characteristics - National Data"
68_371_DF_DCCV_TURISTI_8,"Persons who made trips by type of trip, age group and quarter. Share per 100 inhabitants with the same characteristics - National Data"
68_371_DF_DCCV_TURISTI_9,Employed aged 15 and over who made business trips by gender and quarter. Absolute values (in thousands) - National Data
68_380,Trips by characteristics of the trip
68_380_DF_DCCV_VIAGGI_CHARACT_1,"Trips by quarter, main destination and type of trip. Absolute values (in thousands) - National Data"
68_380_DF_DCCV_VIAGGI_CHARACT_10,Holidays and Business Trips by main destination and main accomodation. Absolute values (in thousands) - National Data
68_380_DF_DCCV_VIAGGI_CHARACT_11,Trips by quarter and type of trip. Percentage values on trips made during the reporting period - National Data
68_380_DF_DCCV_VIAGGI_CHARACT_12,Trips by main destination and organization. Percentage values on trips with the same destination - National Data
68_380_DF_DCCV_VIAGGI_CHARACT_13,"Trips by starting year, month and type of trip. Percentage values on trips of the same type - National Data"
68_380_DF_DCCV_VIAGGI_CHARACT_14,Trips by main destination and type of trip. Percentage values on trips of the same type - National Data
68_380_DF_DCCV_VIAGGI_CHARACT_15,Trips by organization of accomodation and type of trip. Percentage values on trips of the same type - National Data
68_380_DF_DCCV_VIAGGI_CHARACT_16,Trips by organization of transport and type of trip. Percentage values on trips of the same type - National Data
68_380_DF_DCCV_VIAGGI_CHARACT_17,Trips with accommodation and transport booked via Internet by type of trip. Percentage values on trips of the same type - National Data
68_380_DF_DCCV_VIAGGI_CHARACT_18,"Trips by main destination, organization and type of trip. Percentage values on trips of the same type and with the same destination - National Data"
68_380_DF_DCCV_VIAGGI_CHARACT_19,Holidays and Business Trips by main destination and main means of transport. Percentage values on trips of the same type and with the same destination - National Data
68_380_DF_DCCV_VIAGGI_CHARACT_2,"Trips by starting year, month and type of trip. Absolute values (in thousands) - National Data"
68_380_DF_DCCV_VIAGGI_CHARACT_20,Holidays and Business Trips by main destination and main accomodation. Percentage values on trips of the same type and with the same destination - National Data
68_380_DF_DCCV_VIAGGI_CHARACT_21,Trips abroad by country of destination and type of trip. Absolute values (in thousands) - National Data
68_380_DF_DCCV_VIAGGI_CHARACT_22,Trips abroad by country of destination and type of trip. Percentage values on trips abroad of the same type - National Data
68_380_DF_DCCV_VIAGGI_CHARACT_23,Trips in Italy by region of destination and type of trip. Absolute values (in thousands) - National Data
68_380_DF_DCCV_VIAGGI_CHARACT_24,Trips abroad by region of destination and type of trip. Percentage values on trips in Italy of the same type - National Data
68_380_DF_DCCV_VIAGGI_CHARACT_25,Average trip per capita by geographical area
68_380_DF_DCCV_VIAGGI_CHARACT_3,Trips by main destination and type of trip. Absolute values (in thousands) - National Data
68_380_DF_DCCV_VIAGGI_CHARACT_4,"Trips by main destination, organization and type of trip. Absolute values (in thousands) - National Data"
68_380_DF_DCCV_VIAGGI_CHARACT_5,Trips by main destination and organization. Absolute values (in thousands) - National Data
68_380_DF_DCCV_VIAGGI_CHARACT_6,Trips by organization of accomodation and type of trip. Absolute values (in thousands) - National Data
68_380_DF_DCCV_VIAGGI_CHARACT_7,Trips by organization of transport and type of trip. Absolute values (in thousands) - National Data
68_380_DF_DCCV_VIAGGI_CHARACT_8,Trips with accommodation and transport booked via Internet by type of trip. Absolute values (in thousands) - National Data
68_380_DF_DCCV_VIAGGI_CHARACT_9,Holidays and Business Trips by main destination and main means of transport. Absolute values (in thousands) - National Data
68_381,Overnight stays for trips
68_381_DF_DCCV_TURNOT_1,"Overnight stays for trips by quarter, main destination and type of trip. Absolute values (in thousands) - National Data"
68_381_DF_DCCV_TURNOT_10,Overnight stays for main destination and type of trip. Percentage values on overnight stays for trips of the same type - National Data
68_381_DF_DCCV_TURNOT_11,"Overnight stays for trips by main destination, main type of accommodation and type of trip. Percentage values on overnight stays for trips of the same type and with the same destination - National Data"
68_381_DF_DCCV_TURNOT_12,Overnight stays for main destination and type of trip. Percentage values on overnight stays for trips of the same type and with the same destination - Sub National Data
68_381_DF_DCCV_TURNOT_13,Overnight stays for main destination and type of trip. Percentage values on overnight stays for trips of the same type and with the same origin of person who made trip - Sub National Data
68_381_DF_DCCV_TURNOT_14,"Overnight stays for trips by gender, age group and type of trip. Percentage values on overnight stays for trips of the same type made by people with the same sex - National Data"
68_381_DF_DCCV_TURNOT_15,Overnight stays in Italy by region of destination and type of trip. Percentage values on overnight stays for trips in Italy of the same type - National Data
68_381_DF_DCCV_TURNOT_16,Overnight stays abroad by country of destination and type of trip. Percentage values on overnight stays for trips abroad of the same type - National Data
68_381_DF_DCCV_TURNOT_17,Overnight stays for trips made by residend aged 15 and over by employment status and type of trip. Percentage values on overnight stays for trips of the same type - National Data
68_381_DF_DCCV_TURNOT_18,"Average number of overnight stays for trips by quarter, main destination and type of trip - National Data"
68_381_DF_DCCV_TURNOT_19,Average daily presence (overnight stays) of holiday. Share per 1000 inhabitants - National Data
68_381_DF_DCCV_TURNOT_2,"Overnight stays for trips by main destination, main type of accommodation and type of trip. Absolute values (in thousands) - National Data"
68_381_DF_DCCV_TURNOT_3,Overnight stays for main destination and type of trip. Absolute values (in thousands) - National Data
68_381_DF_DCCV_TURNOT_4,"Overnight stays for trips by gender, age group and type of trip. Absolute values (in thousands) - National Data"
68_381_DF_DCCV_TURNOT_5,Overnight stays for main destination and type of trip. Absolute values (in thousands) - Sub National Data
68_381_DF_DCCV_TURNOT_6,Overnight stays in Italy by region of destination and type of trip. Absolute values (in thousands) - National Data
68_381_DF_DCCV_TURNOT_7,Overnight stays abroad by country of destination and type of trip. Absolute values (in thousands) - National Data
68_381_DF_DCCV_TURNOT_8,Overnight stays for trips made by residend aged 15 and over by employment status and type of trip. Absolute values (in thousands) - National Data
68_381_DF_DCCV_TURNOT_9,Overnight stays for holiday and business trips by quarter. Percentage values on total overnight stays for trips - National Data
68_697,Trips by purpose
68_697_DF_DCCV_VIAGGI_CAPI_1,Holidays
68_697_DF_DCCV_VIAGGI_CAPI_2,Holiday trips of 4 or more overnight stays
68_697_DF_DCCV_VIAGGI_CAPI_3,Holiday trips for pleasure/leisure - annual data
68_697_DF_DCCV_VIAGGI_CAPI_4,Holiday trips for pleasure/leisure - quarterly data
68_697_DF_DCCV_VIAGGI_CAPI_5,Holiday trips for pleasure/leisure by main destination
68_697_DF_DCCV_VIAGGI_CAPI_6,Holiday trips for pleasure/leisure by lenght
68_697_DF_DCCV_VIAGGI_CAPI_7,Business trips
68_698,Trips and their characteristics
68_698_DF_DCCV_VIAGGI_CHARACT_CAPI_1,Destination - quarterly data
68_698_DF_DCCV_VIAGGI_CHARACT_CAPI_10,Region of destination
68_698_DF_DCCV_VIAGGI_CHARACT_CAPI_11,Foreign country of destination
68_698_DF_DCCV_VIAGGI_CHARACT_CAPI_12,Trip per capital
68_698_DF_DCCV_VIAGGI_CHARACT_CAPI_2,Accomodation and destination
68_698_DF_DCCV_VIAGGI_CHARACT_CAPI_3,Means of transport and destination
68_698_DF_DCCV_VIAGGI_CHARACT_CAPI_4,Type of booking and trip in Italy or abroad (until 2018)
68_698_DF_DCCV_VIAGGI_CHARACT_CAPI_5,Type of booking and destination (until 2018)
68_698_DF_DCCV_VIAGGI_CHARACT_CAPI_6,Accomodation booking
68_698_DF_DCCV_VIAGGI_CHARACT_CAPI_7,Booking of the transport
68_698_DF_DCCV_VIAGGI_CHARACT_CAPI_8,Internet booking
68_698_DF_DCCV_VIAGGI_CHARACT_CAPI_9,Starting month
68_699,Trips by characteristics of the tourist
68_699_DF_DCCV_VIAGGI_RES_CAPI_1,"Gender, age class"
68_699_DF_DCCV_VIAGGI_RES_CAPI_2,Professional status
68_699_DF_DCCV_VIAGGI_RES_CAPI_3,Residence and destination
68_699_DF_DCCV_VIAGGI_RES_CAPI_4,Residence and type of trip
68_699_DF_DCCV_VIAGGI_RES_CAPI_5,Holidays - residence and type of accommodation
68_699_DF_DCCV_VIAGGI_RES_CAPI_6,Holidays - residence and means of transport
68_702,Trips and overnightstays – Statistical back recalculation 1997-2013
68_702_DF_DCCV_TUR_RIC_CAPI_1,Quarterly data
68_702_DF_DCCV_TUR_RIC_CAPI_2,Residence - geographical area
6_1095_DF_DCCN_ISTITUZ_TNA1_B19_1,Disposable income of the households in the italian regions - editions from January 2020 to December 2023
6_20,Research and Development
6_20_DF_DCSP_RS_1,Expenditure (% of GDP)
6_20_DF_DCSP_RS_10,Personnel by qualification - ISCED
6_20_DF_DCSP_RS_11,Personnel by field of science
6_20_DF_DCSP_RS_12,Business personnel by economic activitiy (Nace 2 digit)
6_20_DF_DCSP_RS_13,Personnel - reg.
6_20_DF_DCSP_RS_14,Business expenditure by user sector
6_20_DF_DCSP_RS_15,In-house research and development expenditure of enterprises by corporate control
6_20_DF_DCSP_RS_2,Government budget appropiations or outlays for research and development
6_20_DF_DCSP_RS_3,Expenditure by type of R&D
6_20_DF_DCSP_RS_4,Expenditure by source of funds
6_20_DF_DCSP_RS_5,Expenditure by field of science
6_20_DF_DCSP_RS_6,Expenditure by type of costs
6_20_DF_DCSP_RS_7,Expenditure - reg.
6_20_DF_DCSP_RS_8,Business expenditure by size class of person employed
6_20_DF_DCSP_RS_9,Business expenditure by economic activity (Nace 2 digit)
6_379_DF_DCCN_OCCTSEC2010_B19_1,Employment - regions - editions from January 2020 to December 2023
6_379_DF_DCCN_OCCTSEC2010_B19_2,Employment - provinces - editions from January 2020 to December 2023
6_379_DF_DCCN_OCCTSEC2010_B19_3,Rate of undeclared work - editions from January 2020 to December 2023
