,0
101_1015,Crops
101_1015_DF_DCSP_COLTIVAZIONI_1,Areas and production - overall data
101_1015_DF_DCSP_COLTIVAZIONI_10,Sowing forecast
101_1015_DF_DCSP_COLTIVAZIONI_2,Areas and production - overall data - provinces
101_1030,"PDO, PGI and TSG quality products"
101_1030_DF_DCSP_DOPIGP_1,Operators by sector
101_1030_DF_DCSP_DOPIGP_2,Operators by product
101_1030_DF_DCSP_DOPIGP_3,Dynamics of operators
101_1030_DF_DCSP_DOPIGP_4,"PDO, PGI and TSG active products"
101_1030_DF_DCSP_DOPIGP_5,Working process by altimetric zone
101_1030_DF_DCSP_DOPIGP_6,Working process by sex of the conductor
101_1033,Slaughtering
101_1033_DF_DASH_DCSP_MACELLAZIONI_1,Meat - monthly data
101_1033_DF_DCSP_MACELLAZIONI_1,Red meat - monthly data
101_1033_DF_DCSP_MACELLAZIONI_2,White meat - monthly data
101_1033_DF_DCSP_MACELLAZIONI_3,Red meat - annual data
101_1033_DF_DCSP_MACELLAZIONI_4,White meat - annual data
101_1039,Agritourism - municipalities
101_1039_DF_DCSP_AGRITURISMO_COM_1,Agritourism - municipalities
101_1077,"PDO, PGI and TSG products:  operators - municipalities data"
101_1077_DF_DCSP_DOPIGP_COM_1,"PDO, PGI and TSG products: operators - municipalities data"
101_12,Agricoltural prices
101_12_DF_DCSP_PREZZIAGR_1,"Agricultural purchase price index, monthly data (base 2015)"
101_12_DF_DCSP_PREZZIAGR_10,"Agricultural producer price index, monthly data (base 2020)"
101_12_DF_DCSP_PREZZIAGR_11,"Agricultural purchase price index, annual average (base 2020)"
101_12_DF_DCSP_PREZZIAGR_12,"Agricultural producer price index, annual average (base 2020)"
101_12_DF_DCSP_PREZZIAGR_2,"Agricultural producer price index, monthly data (base 2015)"
101_12_DF_DCSP_PREZZIAGR_3,"Agricultural purchase price index, annual average (base 2015)"
101_12_DF_DCSP_PREZZIAGR_4,"Agricultural producer price index, annual average (base 2015)"
101_12_DF_DCSP_PREZZIAGR_5,"Agricultural purchase price index, monthly data (base 2010)"
101_12_DF_DCSP_PREZZIAGR_6,"Agricultural producer price index, monthly data (base 2010)"
101_12_DF_DCSP_PREZZIAGR_7,"Agricultural purchase price index, annual average (base 2010)"
101_12_DF_DCSP_PREZZIAGR_8,"Agricultural producer price index, annual average (base 2010)"
101_12_DF_DCSP_PREZZIAGR_9,"Agricultural purchase price index, monthly data (base 2020)"
101_148,Economic results of farms
101_148_DF_DCSP_RICAREA_1,Economic results of farms - Key data
101_148_DF_DCSP_RICAREA_2,Farm average economic values by AWU class
101_148_DF_DCSP_RICAREA_3,Farm average economic values by turnover class
101_148_DF_DCSP_RICAREA_4,Farm average economic values by legal form
101_148_DF_DCSP_RICAREA_5,Performance indicators by sector
101_22,Plant protection products
101_22_DF_DCSP_FITOSANITARI_1,Distributed products - provinces
101_22_DF_DCSP_FITOSANITARI_2,Active substances conteined - provinces
101_22_DF_DCSP_FITOSANITARI_3,Use by type of crop - Key data
101_22_DF_DCSP_FITOSANITARI_4,Use - detail of active substances
101_22_DF_DCSP_FITOSANITARI_5,Treatmemts made class
101_959,Milk and dairy products
101_959_DF_DCSP_LATTE_1,Products - monthly data
101_959_DF_DCSP_LATTE_2,Products by kind of productive unit
101_959_DF_DCSP_LATTE_3,Quantity of fresh products imported
101_959_DF_DCSP_LATTE_4,Products and factories by tonnes of product
101_959_DF_DCSP_LATTE_5,Factories by productive unit - reg
101_959_DF_DCSP_LATTE_6,Products - reg
101_961,Livestock
101_961_DF_DCSP_CONSISTENZE_1,Livestock at 1st of december - regional
101_961_DF_DCSP_CONSISTENZE_2,Livestock at 1st of june
101_962,Livestock import export
101_962_DF_DCSP_LIVESTIMPEXP_1,Live animals - Monthly data
101_962_DF_DCSP_LIVESTIMPEXP_2,Live animals - Annual data
101_962_DF_DCSP_LIVESTIMPEXP_3,Meat - Monthly data
101_962_DF_DCSP_LIVESTIMPEXP_4,Meat - Annual data
101_965,Agritourism
101_965_DF_DCSP_AGRITURISMO_1,Authorized farms
101_965_DF_DCSP_AGRITURISMO_2,Agrituristic services
101_965_DF_DCSP_AGRITURISMO_3,Altimetric zone and conductor sex - provincial data
101_965_DF_DCSP_AGRITURISMO_4,Authorised duration of agritouristic activity - provincial data
101_965_DF_DCSP_AGRITURISMO_5,Authorized farms dinamic - provincial data
102_974,Farm structure
102_974_DF_DCSP_SPA_1,Farm and area by land ownership
102_974_DF_DCSP_SPA_10,Farms with renevable energy
102_974_DF_DCSP_SPA_11,Farms and mechanical means
102_974_DF_DCSP_SPA_12,Farms by legal form
102_974_DF_DCSP_SPA_13,Farms by farm manager educational level
102_974_DF_DCSP_SPA_14,Persons and working days by labour force category
102_974_DF_DCSP_SPA_2,Farm and area by class of agricoltural area
102_974_DF_DCSP_SPA_3,Farm and area by management system
102_974_DF_DCSP_SPA_4,Farm with irrigable and irrigated area
102_974_DF_DCSP_SPA_5,Farms and agricoltural area with organic farming
102_974_DF_DCSP_SPA_6,Farms and agricoltural area
102_974_DF_DCSP_SPA_7,Farms and agricoltural area by crops
102_974_DF_DCSP_SPA_8,Farms and livestock
102_974_DF_DCSP_SPA_9,Farms with gainful activities
104_466,Fertilizars
104_466_DF_DCSP_FERTILIZZANTI_1,Fertilizers distribuited by product status - reg.
104_466_DF_DCSP_FERTILIZZANTI_2,Fertilizers distribuited for use in organic farming - reg.
104_466_DF_DCSP_FERTILIZZANTI_3,Fertilizers distribuited by production area - reg.
104_466_DF_DCSP_FERTILIZZANTI_4,Fertilizers distributed - prov.
104_466_DF_DCSP_FERTILIZZANTI_5,Plant nutrients contained - prov.
104_466_DF_DCSP_FERTILIZZANTI_6,Plant nutrients contained by type of fertilizer
104_466_DF_DCSP_FERTILIZZANTI_7,Plant nutrients contained by hectare of area fit for being fertilized - reg.
111_111,Building permits  indicators
111_111_DF_DCSC_PERM_RAP1_1,New residential buildings
111_111_DF_DCSC_PERM_RAP1_2,New non-residential construction
111_263,Business confidence in the manufacturing sector
111_263_DF_DCSC_FIDIMPRMAN_1,Monthly seasonally adjusted climate and balances
111_263_DF_DCSC_FIDIMPRMAN_10,"Monthly raw climate, balances and frequency - geographical areas"
111_263_DF_DCSC_FIDIMPRMAN_11,"Monthly raw climate, balances and frequency by NACE"
111_263_DF_DCSC_FIDIMPRMAN_12,Monthly raw balances and frequency by size class of persons employed
111_263_DF_DCSC_FIDIMPRMAN_13,Quarterly seasonally adjusted export and capacity utilisation
111_263_DF_DCSC_FIDIMPRMAN_14,Quarterly raw export and capacity utilisation - rip.
111_263_DF_DCSC_FIDIMPRMAN_15,Quarterly raw export and capacity utilisation by NACE
111_263_DF_DCSC_FIDIMPRMAN_16,Quarterly raw export and capacity utilisation by size class of persons employed
111_263_DF_DCSC_FIDIMPRMAN_17,Monthly seasonally adjusted climate and balances
111_263_DF_DCSC_FIDIMPRMAN_18,"Monthly raw climate, balances and frequency - geographical areas"
111_263_DF_DCSC_FIDIMPRMAN_19,"Monthly raw climate, balances and frequency by NACE"
111_263_DF_DCSC_FIDIMPRMAN_2,"Monthly raw climate, balances and frequency - geographical areas"
111_263_DF_DCSC_FIDIMPRMAN_20,Monthly raw balances and frequency by size class of persons employed
111_263_DF_DCSC_FIDIMPRMAN_21,Quarterly seasonally adjusted export and capacity utilisation
111_263_DF_DCSC_FIDIMPRMAN_22,Quarterly raw export and capacity utilisation - rip.
111_263_DF_DCSC_FIDIMPRMAN_23,Quarterly raw export and capacity utilisation by NACE
111_263_DF_DCSC_FIDIMPRMAN_24,Quarterly raw export and capacity utilisation by size class of persons employed
111_263_DF_DCSC_FIDIMPRMAN_3,"Monthly raw climate, balances and frequency by NACE"
111_263_DF_DCSC_FIDIMPRMAN_4,Monthly raw balances and frequency by size class of persons employed
111_263_DF_DCSC_FIDIMPRMAN_5,Quarterly seasonally adjusted export and capacity utilisation
111_263_DF_DCSC_FIDIMPRMAN_6,Quarterly raw export and capacity utilisation - rip.
111_263_DF_DCSC_FIDIMPRMAN_7,Quarterly raw export and capacity utilisation by NACE
111_263_DF_DCSC_FIDIMPRMAN_8,Quarterly raw export and capacity utilisation by size class of persons employed
111_263_DF_DCSC_FIDIMPRMAN_9,Monthly seasonally adjusted climate and balances
111_40,Business confidence in the construction sector
111_40_DF_DCSC_FIDIMPRCOSTR_1,Seasonally adjusted climate and balances - monthly
111_40_DF_DCSC_FIDIMPRCOSTR_2,"Raw climate, balances and frequency by divisions of constructions - monthly"
111_40_DF_DCSC_FIDIMPRCOSTR_3,Raw activity secured - quarterly
111_40_DF_DCSC_FIDIMPRCOSTR_4,Seasonally adjusted climate and balances - monthly
111_40_DF_DCSC_FIDIMPRCOSTR_5,"Raw climate, balances and frequency by divisions of constructions - monthly"
111_40_DF_DCSC_FIDIMPRCOSTR_6,Raw activity secured - quarterly
111_40_DF_DCSC_FIDIMPRCOSTR_7,Seasonally adjusted climate and balances - monthly
111_40_DF_DCSC_FIDIMPRCOSTR_8,"Raw climate, balances and frequency by divisions of constructions - monthly"
111_40_DF_DCSC_FIDIMPRCOSTR_9,Raw activity secured - quarterly
114_191,Industrial new orders and turnover index
114_191_DF_DCSC_ORDFATT_1,Industrial turnover - Monthly (base 2015)
114_191_DF_DCSC_ORDFATT_10,Industrial volume turnover - Monthly data (base 2021)
114_191_DF_DCSC_ORDFATT_2,Manufacturing turnover volume index - Monthly (base 2015)
114_191_DF_DCSC_ORDFATT_3,Industrial new orders - monthly data (base 2015 - until December 2020)
114_191_DF_DCSC_ORDFATT_4,New orders - Monthly (base 2010)
114_191_DF_DCSC_ORDFATT_5,Turnover - Monthly (base 2010)
114_191_DF_DCSC_ORDFATT_6,Manifacturing turnover volume - Monthly (base 2010)
114_191_DF_DCSC_ORDFATT_7,New orders - Monthly (base 2005)
114_191_DF_DCSC_ORDFATT_8,Turnover - Monthly (base 2005)
114_191_DF_DCSC_ORDFATT_9,Industrial turnover  - Monthly data (base 2021)
115_168,Industrial production volume
115_168_DF_DCSP_PRODCOM_1,Production value by Nace Rev.2 (division)
115_168_DF_DCSP_PRODCOM_2,Production value and volume by single product (Prodcom)
115_168_DF_DCSP_PRODCOM_3,Production value and volume for all products (Prodcom)
115_333,Industrial production index
115_333_DF_DCSC_INDXPRODIND_1_1,Industrial production index - Monthly data (base 2015)
115_333_DF_DCSC_INDXPRODIND_1_2,Detail production index - (Ateco 4 digit)
115_333_DF_DCSC_INDXPRODIND_1_4,Monthly data (base 2010)
115_333_DF_DCSC_INDXPRODIND_1_5,Monthly data (base 2005)
115_333_DF_DCSC_INDXPRODIND_1_6,Industrial production index - Monthly data (base 2021)
115_362,Index of production in construction
115_362_DF_DCSC_INDXPRODCOSTR_1_1,Index of production in construction - Monthly data (base 2015)
115_362_DF_DCSC_INDXPRODCOSTR_1_2,Monthly data (base 2010)
115_362_DF_DCSC_INDXPRODCOSTR_1_3,Monthly data (base 2005)
115_362_DF_DCSC_INDXPRODCOSTR_1_4,Index of production in construction - Monthly data (base 2021)
117_1035,Bank services - municipalities data
117_1035_DF_DCAT_SERVBANC_COM_1,Bank services - municipalities data
117_1057,Rail transport
117_1057_DF_DCSC_TRAFERR_1,Rail transport - Key data
117_1057_DF_DCSC_TRAFERR_2,Passengers and average distance dy destination
117_1057_DF_DCSC_TRAFERR_3,Goods transported by type of goods (NST/2007)
117_1057_DF_DCSC_TRAFERR_4,Goods transported by destination country
117_1057_DF_DCSC_TRAFERR_5,Goods transported by origin caoutry
117_1057_DF_DCSC_TRAFERR_6,Intermodal transport
117_1057_DF_DCSC_TRAFERR_7,Dangerous goods
117_1057_DF_DCSC_TRAFERR_8,Rail transport accidents
117_262,Business confidence in the market services sector
117_262_DF_DCSC_FIDIMPRSERV_1,"Climate and balance (Nace section) - Monthly data, raw and seasonally adjusted"
117_262_DF_DCSC_FIDIMPRSERV_10,Balance and frequency (Nace 2 digit) - Monthly raw data
117_262_DF_DCSC_FIDIMPRSERV_11,Factors limiting production and capacity utilisation raw balance and frequency - Quaterly raw data
117_262_DF_DCSC_FIDIMPRSERV_2,"Climate, frequency and balance - Monthly data, raw and seasonally adjusted - Geographical areas"
117_262_DF_DCSC_FIDIMPRSERV_3,Balance and frequency (Nace 2 digit) - Monthly raw data
117_262_DF_DCSC_FIDIMPRSERV_4,Factors limiting production and capacity utilisation raw balance and frequency - Quaterly raw data
117_262_DF_DCSC_FIDIMPRSERV_5,Monthly seasonally adjusted climate and balance by NACE Rev. 2 - level national and geographical area
117_262_DF_DCSC_FIDIMPRSERV_6,"Monthly raw balance, climate and frequency by NACE Rev.2 - level national and geografical area"
117_262_DF_DCSC_FIDIMPRSERV_7,Quaterly factors limiting production and capacity utilisation raw balance and frequency -
117_262_DF_DCSC_FIDIMPRSERV_8,"Climate and balance (Nace section) - Monthly data, raw and seasonally adjusted"
117_262_DF_DCSC_FIDIMPRSERV_9,"Climate, frequency and balance - Monthly data, raw and seasonally adjusted - Geographical areas"
117_266,Business confidence in the retail trade Sector
117_266_DF_DCSC_FIDCOMM_1,Climate and balances by type of sales - Monthly data seasonally adjusted
117_266_DF_DCSC_FIDCOMM_2,"Climate, balances and frequencies by Nace Rev.2 and type of sales - Monthly raw data"
117_266_DF_DCSC_FIDCOMM_3,Monthly seasonally adjusted climate and balances by type of sales
117_266_DF_DCSC_FIDCOMM_4,Monthly seasonally adjusted climate and balances by type of sales
117_266_DF_DCSC_FIDCOMM_5,Climate and balances by type of sales - Monthly data seasonally adjusted
117_266_DF_DCSC_FIDCOMM_6,"Climate, balances and frequencies by Nace Rev.2 and type of sales - Monthly raw data"
119_367,Indexes of turnover in other services
119_367_DF_DCSC_FATTSERVIZ_1_1,Raw data - Quarterly data (base 2015)
119_367_DF_DCSC_FATTSERVIZ_1_2,Quarterly data (base 2010)
119_367_DF_DCSC_FATTSERVIZ_1_3,Quarterly data (base 2005)
119_367_DF_DCSC_FATTSERVIZ_1_4,Indexes of turnover in services - Monthly (base 2021=100)
11_111,Residential construction - annual data
11_111_DF_DCSC_RESID_CONSTR_1,New residential buildings and related dwellings - provinces and municipality classes
11_111_DF_DCSC_RESID_CONSTR_10,Surface areas of new residential buildings by intended use  - geographical areas and municipality classes
11_111_DF_DCSC_RESID_CONSTR_11,New residential buildings and extensions with related dwellings by holder of the title to build - regions and municipality classes
11_111_DF_DCSC_RESID_CONSTR_12,New residential buildings by heating system type - geographical areas and municipality classes
11_111_DF_DCSC_RESID_CONSTR_13,Extensions of residential buildings with or without additional floors - geographical areas and municipality classes
11_111_DF_DCSC_RESID_CONSTR_14,New residences for communities and extensions of residences for communities - geographical areas and municipality classes
11_111_DF_DCSC_RESID_CONSTR_15,New residential buildings and extensions of residential buildings by piano casa - geographical areas and municipality classes
11_111_DF_DCSC_RESID_CONSTR_2,Extensions of residential buildings - provinces and municipality classes
11_111_DF_DCSC_RESID_CONSTR_3,New residential buildings by number of dwellings - regions and municipality classes
11_111_DF_DCSC_RESID_CONSTR_4,New residential buildings and extensions of residential buildings by title to build - geographical areas and municipality classes
11_111_DF_DCSC_RESID_CONSTR_5,New residential buildings and extensions of residential buildings by estimated duration of works - geographical areas and municipality classes
11_111_DF_DCSC_RESID_CONSTR_6,Dwellings in new residential buildings by number of rooms - provinces
11_111_DF_DCSC_RESID_CONSTR_7,Dwellings in new residential buildings by useful floor area classes - provinces
11_111_DF_DCSC_RESID_CONSTR_8,Dwellings in new residential buildings by number of rooms and useful floor area classes - geographical areas and municipality classes
11_111_DF_DCSC_RESID_CONSTR_9,New residential buildings by number of floors - regions and municipality classes
120_337,Index of retail trade sales
120_337_DF_DCSC_COMMDET_1_1,Retail trade sales by type of product employment size class- monthly data (base 2015)
120_337_DF_DCSC_COMMDET_1_10,Retail trade sales by type of product and type of sales - Monthly data (base 2005)
120_337_DF_DCSC_COMMDET_1_11,Retail trade sales by type of product and employment size class - Monthly data (base 2005)
120_337_DF_DCSC_COMMDET_1_12,Retail trade sales by type of product employment size class - monthly data (base 2021)
120_337_DF_DCSC_COMMDET_1_13,Retail trade sales by type of product and type of sales - monthly data (base 2021)
120_337_DF_DCSC_COMMDET_1_14,Retail trade sales by type of product - monthly raw data (base 2021)
120_337_DF_DCSC_COMMDET_1_15,Volume of retail trade sales index by type of product - monthly data (base 2021)
120_337_DF_DCSC_COMMDET_1_2,Retail trade sales by type of product and type of sales - monthly data (base 2015)
120_337_DF_DCSC_COMMDET_1_3,Retail trade sales by type of product - monthly raw data (base 2015)
120_337_DF_DCSC_COMMDET_1_4,Volume of retail trade sales index by type of product - monthly data (base 2015)
120_337_DF_DCSC_COMMDET_1_5,Retail trade sales by type of sales and employment size class - monthly data (base 2010)
120_337_DF_DCSC_COMMDET_1_6,Retail trade sales by type of product and type of sales - monthly data (base 2010)
120_337_DF_DCSC_COMMDET_1_7,Retail trade sales by type of product and employment size class - monthly data (base 2010)
120_337_DF_DCSC_COMMDET_1_8,Retail trade sales index by type of product - monthly data (base 2010)
120_337_DF_DCSC_COMMDET_1_9,Retail trade sales by type of sales and employment size class - Monthly data (base 2005)
121_329,Road freight carriage by category of transport
121_329_DF_DCSC_TRAMERCIS2_1,"Road freight transport by category of transport, distance class and type of transport"
121_330,Road freight transport
121_330_DF_DCSC_TRAMERCIS1_1,Goods carried by type of transport and distance class
121_330_DF_DCSC_TRAMERCIS1_2,"Goods carried - tons by type of goods (chapter), loading and unloading region"
121_330_DF_DCSC_TRAMERCIS1_3,"Goods carried - tons- by type of transport, loading and unloading region"
121_330_DF_DCSC_TRAMERCIS1_4,Goods carried by oading place and type of transport (domestic transport)
121_330_DF_DCSC_TRAMERCIS1_5,Goods carried by loading place and type of transport (total transport)
121_330_DF_DCSC_TRAMERCIS1_6,Goods carried by unloading place and type of transport (domestic transport)
121_330_DF_DCSC_TRAMERCIS1_7,Goods carried by unloading place and type of transport (total transport)
121_331,Air transport
121_331_DF_DCSC_INDTRAEREO_1,Internal and internazional
121_331_DF_DCSC_INDTRAEREO_2,International by country of origin/destination
121_331_DF_DCSC_INDTRAEREO_3,"International from and to Linate, Malpensa, Fiumicino"
121_331_DF_DCSC_INDTRAEREO_4,Quarterly data
121_393,Maritime transport
121_393_DF_DCSC_TRAMAR_1,Passengers and goods
121_393_DF_DCSC_TRAMAR_2,Passengers for each port by direction
121_393_DF_DCSC_TRAMAR_3,"Goods for port by direction, by tipe of cargo and goods NST 2007"
121_393_DF_DCSC_TRAMAR_4,International goods by country of origin or destination and type of goods NST 2007 (Countries that transport more than one million tons)
121_393_DF_DCSC_TRAMAR_5,National goods by italian region of loading or destination
121_393_DF_DCSC_TRAMAR_6,"Goods, number and gross tonnage of vessel by italian region"
121_393_DF_DCSC_TRAMAR_7,Port and type of goods NST/R
121_393_DF_DCSC_TRAMAR_8,International goods by country of origin or destination and type of goods NST/R (Countries that transport more than one million tons)
122_54,Capacity of collective accommodation establishments and Occupancy in collective accommodation establishments
122_54_DF_DCSC_TUR_1,Capacity of collective accommodation establishments by type of accomodation - com.
122_54_DF_DCSC_TUR_10,Type of locality and country of residence
122_54_DF_DCSC_TUR_11,"By region, by residence - monthly and yearly"
122_54_DF_DCSC_TUR_12,"By class, by residence - yearly"
122_54_DF_DCSC_TUR_13,"Arrivals, nights spent, average lenght of stay - Monthly data"
122_54_DF_DCSC_TUR_2,Size of hotels and similar establishments - prov.
122_54_DF_DCSC_TUR_3,Occupancy in collective tourist accomodation by type of accomodation - monthly data
122_54_DF_DCSC_TUR_4,Residents by region of origin
122_54_DF_DCSC_TUR_5,Country of origin
122_54_DF_DCSC_TUR_6,Type of locality
122_54_DF_DCSC_TUR_7,Movement of guests in the collective accommodation establishments by type of accommodation - annual data
122_54_DF_DCSC_TUR_8,Residents by region
122_54_DF_DCSC_TUR_9,Country of origin - prov
123_712_DF_DCAR_INDBILPER_1,Accounts indicators and institutional units personnel indicators
123_713,Number and type of institutional units
123_713_DF_DCAR_UI_1,Number and type of institutional units
123_840,Institutional units activities and organization
123_840_DF_DCAR_INDCENS_PA_1,Indicators
123_840_DF_DCAR_INDCENS_PA_2,Some services functionality
124_1156_DF_DCAR_STATPAT_UNI_1,"Public universities, polytechnic institutes and institutes of higher education balance sheet (euros)"
124_1157_DF_DCAR_CONTECON_UNI_1,"Universities, polytechnic institutes and institutes of higher education profit and loss account (euros)"
124_229,Chamber of commerce balance sheet - euros
124_229_DF_DCAR_STATPATCC_1,Chamber of commerce balance sheet (euros)
124_231,Revenue of institutional local unities (euros)
124_231_DF_DCAR_ENTIST_1,Revenue of institutional local unities (euros)
124_232,Expenditures of institutional local unities  (euros)
124_232_DF_DCAR_SPEIST_1,Expenditures of institutional local unities (euros)
124_233_DF_DCAR_ENTIST_PA_1,Revenue of State General Account (euro)
124_234_DF_DCAR_SPEIST_PA_1,Expenditures of State General Account (euro)
124_234_DF_DCAR_SPEIST_PA_2,"Expenditures of public universities, polytechnic institutes and institutes of higher education (euro)"
124_322,Chambers of commerce profit and loss account - euros
124_322_DF_DCAR_CONTECON_CC_1,Chambers of commerce profit and loss account (euros)
124_722,"Local health units, hospital companies, university hospitals, general hospitals and hospitals with a scientific character profit and loss account ( thousands of euro)"
124_722_DF_DCAR_CONTECON_ASLAO_1,"Local health units, hospital companies, university hospitals, general hospitals and hospitals with a scientific character profit and loss account (thousands of euro)"
12_323_DF_DCCV_IMPDEP_1,Urban wastewater treatment plants - reg.
12_323_DF_DCCV_IMPDEP_2,Urban wastewater treatment plants - ato
12_340,Water abstraction for drinkable use
12_340_DF_DCCV_PRELACQ_1,Water abstraction for drinkable use
12_60,Public water supply use
12_60_DF_DCCV_CONSACQUA_1,Public water supply use - reg.
12_60_DF_DCCV_CONSACQUA_2,Public water supply use - municipalities
12_60_DF_DCCV_CONSACQUA_3,Public water supply use - River basin district
139_176,Import and export by country and commodity Nace 2007
140_180,Nic - monthly data until 2010 (base 1995)
143_1043,Construction producer prices indeces
143_1043_DF_DCSC_INDPREPROCOSTR_1,Construction producer prices (base 2015)
143_1043_DF_DCSC_INDPREPROCOSTR_2,Construction producer prices (base 2021)
143_222,Import price index - monthly data
143_222_DF_DCSC_PREIMPIND_1,Import prices - Monthly data (base 2015)
143_222_DF_DCSC_PREIMPIND_2,Import prices - Monthly data (base 2021)
143_497,House prices (Ipab)
143_497_DF_DCSP_IPAB_1,Quarterly data from 2010 onwards (base 2015)
143_497_DF_DCSP_IPAB_2,Annual average from 2010 onwards (base 2015)
143_497_DF_DCSP_IPAB_3,Weights from 2010 onwards
143_497_DF_DCSP_IPAB_4,Quarterly data from 2010 until 2016 (base 2010)
143_497_DF_DCSP_IPAB_5,Annual average from 2010 until 2016 (base 2010)
144_107_DF_DCSP_FOI3_1,Foi – weights until 2010
144_110_DF_DCSP_FOI1_1,Foi - monthly data until 2010 (base 1995)
144_118_DF_DCSP_FOI2_1,Foi - annual data until 2010 (base 1995)
144_125_DF_DCSP_NICDUE_1,Coicop classification (2 digit) (base December 1998) - prov.
144_125_DF_DCSP_NICDUE_2,Product types (base 1995)
144_125_DF_DCSP_NICDUE_3,Coicop classification (5 digit) (base 1995)
144_126_DF_DCSP_NICTRE_1,Product types
144_126_DF_DCSP_NICTRE_2,Coicop classification (5 digit)
144_180_DF_DCSP_NICUNOB_1,Coicop classification (2 digit) (base december 1998)
144_180_DF_DCSP_NICUNOB_2,Product types (base 1995)
144_180_DF_DCSP_NICUNOB_3,Coicop classification (5 digit) (base 1995)
145_360,Industrial producer prices
145_360_DF_DCSC_PREZZPIND_1_1,Industrial producer prices - monthly data (base 2015)
145_360_DF_DCSC_PREZZPIND_1_2,Monthly data (base 2010)
145_360_DF_DCSC_PREZZPIND_1_3,Monthly data (base 2005)
145_360_DF_DCSC_PREZZPIND_1_4,Industrial producer prices - monthly data (base 2021)
145_361,Construction costs
145_361_DF_DCSC_FABBRESID_1_1,Residential and non-residential buildings - monthly data (base 2015)
145_361_DF_DCSC_FABBRESID_1_2,Roads with tunnel section - monthly data (base 2015)
145_361_DF_DCSC_FABBRESID_1_3,Road stretches - broken series - monthly data (base 2015)
145_361_DF_DCSC_FABBRESID_1_4,Residential building - monthly data (base 2010)
145_361_DF_DCSC_FABBRESID_1_5,Road stretches - monthly data (base 2010)
145_361_DF_DCSC_FABBRESID_1_6,Residential building from 2000 until 2012 (base 2005) - monthly data
145_361_DF_DCSC_FABBRESID_1_7,Residential and non-residential buildings - monthly data (base 2021)
145_361_DF_DCSC_FABBRESID_1_8,Roads with tunnel section - monthly data (base 2021)
145_361_DF_DCSC_FABBRESID_1_9,Road stretches - broken series - monthly data (base 2015)
145_362_DCSC_INDICITOL_1,Homogeneous types of works - monthly data (base 2022)
145_376,Services producer prices
145_376_DF_DCSC_PREZPRODSERV_1_1,Quarterly data business to business from 2006 to 2023 (base 2015)
145_376_DF_DCSC_PREZPRODSERV_1_2,Annual average business to business from 2006 to 2023 (base 2015)
145_376_DF_DCSC_PREZPRODSERV_1_3,Quarterly data business to business from 2006 to 2017 (base 2010)
145_376_DF_DCSC_PREZPRODSERV_1_4,Annual average business to business from 2006 to 2012 (base 2010)
145_376_DF_DCSC_PREZPRODSERV_1_5,Quarterly data business to business from 2006 until 2012 (base 2006)
145_376_DF_DCSC_PREZPRODSERV_1_6,Annual average business to business from 2006 until 2012 (base 2006)
145_376_DF_DCSC_PREZPRODSERV_1_7,Quarterly data business to business from 2006 (base 2021)
145_376_DF_DCSC_PREZPRODSERV_1_8,Quarterly data business to all from 2006 (base 2021)
